ID,Price,Brand,Model,Tab Title
654055,1799.99,Gigabyte,4090,Gigabyte NVIDIA GeForce RTX 4090 Gaming RGB Overclocked Triple Fan 24GB GDDR6X PCIe 4.0 Graphics Card - Micro Center
654056,288.00,Gigabyte,4090,Gigabyte NVIDIA GeForce RTX 4090 Windforce Triple Fan 24 GB GDDR6X PCIe 4.0 Graphics Card - Micro Center
654069,1999.99,ASUS,4090,ASUS NVIDIA GeForce RTX 4090 ROG Strix RGB Overclocked Triple Fan 24GB GDDR6X PCIe 4.0 Graphics Card - Micro Center
654070,1819.99,ASUS,4090,ASUS GeForce RTX 4090 TUF Gaming RGB Overclocked Triple-Fan 24GB GDDR6X PCIe 4.0 Graphics Card - Micro Center
654370,199.99,NVIDIA,Unknown,"NVIDIA SHIELD Android TV Pro 4K HDR Streaming Media Player - High Performance, Dolby Vision, 3GB RAM, 2 x USB, Google - Micro Center"
